<?xml version="1.0" encoding="UTF-8"?>
<!DOCTYPE Sequence SYSTEM "SequenceDesc.dtd">
<Sequence>
    <Name>Sequence_1</Name>
    <Description>Sequence #1</Description>
    <SampleRate>16000</SampleRate>

    <DTMF>
        *16175551212#
        <OnTime>75</OnTime>
        <OffTime>75</OffTime>
    </DTMF>

    <Silence>250</Silence>

    <Signal>
        <Name>Signal 1</Name>
        <Description>Signal #1</Description>
        <Duration>1000</Duration>
        <Tone>
            <amp>1.0</amp>
            <freq>1200</freq>
            <phase>0</phase>
        </Tone>
        <Tone>
            <amp>2.0</amp>
            <freq>1800</freq>
            <phase>90</phase>
        </Tone>
        <Tone>
            <amp>1.0</amp>
            <freq>2100</freq>
            <phase>180</phase>
        </Tone>
        <Tone>
            <amp>2.0</amp>
            <freq>2400</freq>
            <phase>270</phase>
        </Tone>
    </Signal>
</Sequence>
