<?xml version="1.0" encoding="UTF-8"?>
<!DOCTYPE Sequence SYSTEM "SequenceDesc.dtd">
<Sequence>
    <Name>alarm-low</Name>
    <Description>Perfusion alarm, low priority.</Description>
    <SampleRate>16000</SampleRate>

    <Signal>
        <Name>Pulse 2</Name>
        <Description>Piano E4</Description>
        <Duration>250</Duration>
        <RiseFactor>10.0</RiseFactor>
        <FallFactor>30.0</FallFactor>
        <Tone>
            <freq>329.63</freq>
            <amp>0.5</amp>
            <phase>0</phase>
            <harmonics>2,3,4,5,6,7,8,9,10,11,12,13,14,15,16,17</harmonics>
            <harmonicAmps>0.25119,0.00794,0.01585,0.03162,0.03162,0.02512,0.01000,0.00032,0.00316,0.00158,0.00158,0.00010,0.00158,0.00010,0.00003,0.00006</harmonicAmps>
        </Tone>
    </Signal>

    <Silence>200</Silence>

    <Signal>
        <Name>Pulse 1</Name>
        <Description>Piano C4</Description>
        <Duration>250</Duration>
        <RiseFactor>10.0</RiseFactor>
        <FallFactor>30.0</FallFactor>
        <Tone>
            <freq>261.63</freq>
            <amp>0.5</amp>
            <phase>0</phase>
            <harmonics>2,3,4,5,6,7,8,9,10,11,12,13,14,15,16,17</harmonics>
            <harmonicAmps>0.25119,0.00794,0.01585,0.03162,0.03162,0.02512,0.01000,0.00032,0.00316,0.00158,0.00158,0.00010,0.00158,0.00010,0.00003,0.00006</harmonicAmps>
        </Tone>
    </Signal>

</Sequence>
