<?xml version="1.0" encoding="UTF-8"?>
<!DOCTYPE Sequence SYSTEM "SequenceDesc.dtd">
<Sequence>
    <Name>SIT</Name>
    <Description>SIT Intercept - Number changed or disconnected</Description>
    <SampleRate>16000</SampleRate>

    <Silence>100</Silence>

    <Signal>
        <Name>Tone_1</Name>
        <Description>Tone #1</Description>
        <Duration>330</Duration>
        <Tone>
            <amp>1.0</amp>
            <freq>950.0</freq>
            <phase>0</phase>
        </Tone>
    </Signal>

    <Silence>30</Silence>

    <Signal>
        <Name>Tone_2</Name>
        <Description>Tone #2</Description>
        <Duration>330</Duration>
        <Tone>
            <amp>1.0</amp>
            <freq>1400.0</freq>
            <phase>0</phase>
        </Tone>
    </Signal>

    <Silence>30</Silence>

    <Signal>
        <Name>Tone_3</Name>
        <Description>Tone #3</Description>
        <Duration>330</Duration>
        <Tone>
            <amp>1.0</amp>
            <freq>1800.0</freq>
            <phase>0</phase>
        </Tone>
    </Signal>

    <Silence>100</Silence>
</Sequence>
