<?xml version="1.0" encoding="UTF-8"?>
<!DOCTYPE Sequence SYSTEM "SequenceDesc.dtd">
<Sequence>
    <Name>Modem_A</Name>
    <Description>Modem A tone.</Description>
	<Signal>
	    <Name>Modem_A</Name>
	    <Description>Modem A tone.</Description>
	    <SampleRate>16000</SampleRate>
	    <Duration>1000</Duration>
        <Tone>
            <amp>1.0</amp>
            <freq>1800</freq>
            <phase>0</phase>
        </Tone>
        <Tone>
            <amp>1.0</amp>
            <freq>2400</freq>
            <phase>0</phase>
        </Tone>
	</Signal>
</Sequence>
