<?xml version="1.0" encoding="UTF-8"?>
<!DOCTYPE Sequence SYSTEM "SequenceDesc.dtd">
<Sequence>
    <Name>Sequence_2</Name>
    <Description>Single signal sequence #2</Description>
    <SampleRate>16000</SampleRate>
    <Signal>
        <Name>Signal_2</Name>
        <Description>Signal #2</Description>
        <Duration>1000</Duration>

        <Tone>
            <amp>1.0</amp>
            <freq>1200</freq>
            <phase>0</phase>
        </Tone>

        <Tone>
            <amp>1.0</amp>
            <freq>1800</freq>
            <phase>90</phase>
        </Tone>

        <Tone>
            <amp>1.0</amp>
            <freq>2100</freq>
            <phase>180</phase>
        </Tone>

        <Tone>
            <amp>1.0</amp>
            <freq>2400</freq>
            <phase>270</phase>
        </Tone>

	</Signal>
</Sequence>
