<?xml version="1.0" encoding="UTF-8"?>
<!DOCTYPE Sequence SYSTEM "SequenceDesc.dtd">
<Sequence>
    <Name>perf-high-even</Name>
    <Description>Perfusion alarm, high priority. Even harmonics.</Description>
    <SampleRate>16000</SampleRate>

    <Signal>
        <Name>Pulse_1</Name>
        <Description>Pulse 1</Description>
        <Duration>100</Duration>
        <RiseFactor>10.0</RiseFactor>
        <FallFactor>50.0</FallFactor>
        <!-- C4 -->
        <Tone>
            <amp>1.0</amp>
            <freq>261.63</freq>
            <phase>0</phase>
            <harmonics>2,4,6,8</harmonics>
            <harmonicAmps>0.5,0.2,0.1,0.05</harmonicAmps>
        </Tone>
    </Signal>

    <Silence>125</Silence>

    <Signal>
        <Name>Pulse_2</Name>
        <Description>Pulse 2</Description>
        <Duration>100</Duration>
        <RiseFactor>10.0</RiseFactor>
        <FallFactor>50.0</FallFactor>
        <!-- F#4 -->
        <Tone>
            <amp>1.0</amp>
            <freq>370.0</freq>
            <phase>0</phase>
            <harmonics>2,4,6,8</harmonics>
            <harmonicAmps>0.5,0.2,0.1,0.05</harmonicAmps>
        </Tone>
    </Signal>

    <Silence>125</Silence>

    <Signal>
        <Name>Pulse_3</Name>
        <Description>Pulse 3</Description>
        <Duration>100</Duration>
        <RiseFactor>10.0</RiseFactor>
        <FallFactor>50.0</FallFactor>
        <!-- C4 -->
        <Tone>
            <amp>1.0</amp>
            <freq>261.63</freq>
            <phase>0</phase>
            <harmonics>2,4,6,8</harmonics>
            <harmonicAmps>0.5,0.2,0.1,0.05</harmonicAmps>
        </Tone>
    </Signal>

    <Silence>400</Silence>

    <Signal>
        <Name>Pulse_4</Name>
        <Description>Pulse 4</Description>
        <Duration>100</Duration>
        <RiseFactor>10.0</RiseFactor>
        <FallFactor>50.0</FallFactor>
        <!-- C4 -->
        <Tone>
            <amp>1.0</amp>
            <freq>261.63</freq>
            <phase>0</phase>
            <harmonics>2,4,6,8</harmonics>
            <harmonicAmps>0.5,0.2,0.1,0.05</harmonicAmps>
        </Tone>
    </Signal>

    <Silence>125</Silence>

    <Signal>
        <Name>Pulse_5</Name>
        <Description>Pulse 5</Description>
        <Duration>100</Duration>
        <RiseFactor>10.0</RiseFactor>
        <FallFactor>50.0</FallFactor>
        <!-- F#4 -->
        <Tone>
            <amp>1.0</amp>
            <freq>370.0</freq>
            <phase>0</phase>
            <harmonics>2,4,6,8</harmonics>
            <harmonicAmps>0.5,0.2,0.1,0.05</harmonicAmps>
        </Tone>
    </Signal>

    <Silence>400</Silence>

</Sequence>
