<?xml version="1.0" encoding="UTF-8"?>
<!DOCTYPE Sequence SYSTEM "SequenceDesc.dtd">
<Sequence>
    <Name>Modem_LP</Name>
    <Description>Modem line probing tone</Description>
    <SampleRate>16000</SampleRate>
    <Signal>
        <Name>LP</Name>
        <Description>Modem line probing tone</Description>
        <Duration>1000</Duration>

        <Tone>
            <freq>150</freq>
            <phase>0</phase>
            <amp>1.0</amp>
        </Tone>

        <Tone>
            <freq>300</freq>
            <phase>180</phase>
            <amp>1.0</amp>
        </Tone>

        <Tone>
            <freq>450</freq>
            <phase>0</phase>
            <amp>1.0</amp>
        </Tone>

        <Tone>
            <freq>600</freq>
            <phase>0</phase>
            <amp>1.0</amp>
        </Tone>

        <Tone>
            <freq>750</freq>
            <phase>0</phase>
            <amp>1.0</amp>
        </Tone>

        <!-- 900 Dropout -->
        
        <Tone>
            <freq>1050</freq>
            <phase>0</phase>
            <amp>1.0</amp>
        </Tone>

        <!-- 1200 Dropout -->

        <Tone>
            <freq>1350</freq>
            <phase>0</phase>
            <amp>1.0</amp>
        </Tone>

        <Tone>
            <freq>1500</freq>
            <phase>0</phase>
            <amp>1.0</amp>
        </Tone>

        <Tone>
            <freq>1650</freq>
            <phase>180</phase>
            <amp>1.0</amp>
        </Tone>

        <!-- 1800 Dropout --> 

        <Tone>
            <freq>1950</freq>
            <phase>0</phase>
            <amp>1.0</amp>
        </Tone>

        <Tone>
            <freq>2100</freq>
            <phase>0</phase>
            <amp>1.0</amp>
        </Tone>

        <Tone>
            <freq>2250</freq>
            <phase>180</phase>
            <amp>1.0</amp>
        </Tone>

        <!-- 2400 Dropout --> 

        <Tone>
            <freq>2550</freq>
            <phase>0</phase>
            <amp>1.0</amp>
        </Tone>

        <Tone>
            <freq>2700</freq>
            <phase>180</phase>
            <amp>1.0</amp>
        </Tone>

        <Tone>
            <freq>2850</freq>
            <phase>0</phase>
            <amp>1.0</amp>
        </Tone>

        <Tone>
            <freq>3000</freq>
            <phase>180</phase>
            <amp>1.0</amp>
        </Tone>

        <Tone>
            <freq>3150</freq>
            <phase>180</phase>
            <amp>1.0</amp>
        </Tone>

        <Tone>
            <freq>3300</freq>
            <phase>180</phase>
            <amp>1.0</amp>
        </Tone>

        <Tone>
            <freq>3450</freq>
            <phase>180</phase>
            <amp>1.0</amp>
        </Tone>

        <Tone>
            <freq>3600</freq>
            <phase>0</phase>
            <amp>1.0</amp>
        </Tone>

        <Tone>
            <freq>3750</freq>
            <phase>0</phase>
            <amp>1.0</amp>
        </Tone>

    </Signal>
</Sequence>
