<?xml version="1.0" encoding="UTF-8"?>
<!DOCTYPE Sequence SYSTEM "SequenceDesc.dtd">
<Sequence>
    <Name>Signal_1</Name>
    <Description>Single signal sequence #1</Description>
    <SampleRate>16000</SampleRate>
    <Signal>
        <Name>Signal_1</Name>
        <Description>Signal #1</Description>
        <Duration>1000</Duration>

        <Tone>
            <freq>150</freq>
            <phase>0</phase>
            <amp>1.0</amp>
        </Tone>

        <Tone>
            <freq>300</freq>
            <phase>45</phase>
            <amp>1.0</amp>
        </Tone>

        <Tone>
            <freq>450</freq>
            <phase>90</phase>
            <amp>1.0</amp>
        </Tone>

        <Tone>
            <freq>600</freq>
            <phase>135</phase>
            <amp>1.0</amp>
        </Tone>

        <Tone>
            <freq>750</freq>
            <phase>180</phase>
            <amp>1.0</amp>
        </Tone>

        <Tone>
            <freq>900</freq>
            <phase>225</phase>
            <amp>1.0</amp>
        </Tone>

        <Tone>
            <freq>1050</freq>
            <phase>270</phase>
            <amp>1.0</amp>
        </Tone>

        <Tone>
            <freq>1200</freq>
            <phase>315</phase>
            <amp>1.0</amp>
        </Tone>

        <Tone>
            <freq>1350</freq>
            <phase>0</phase>
            <amp>1.0</amp>
        </Tone>

        <Tone>
            <freq>1500</freq>
            <phase>45</phase>
            <amp>1.0</amp>
        </Tone>

        <Tone>
            <freq>1650</freq>
            <phase>90</phase>
            <amp>1.0</amp>
        </Tone>

        <Tone>
            <freq>1800</freq>
            <phase>135</phase>
            <amp>1.0</amp>
        </Tone>

        <Tone>
            <freq>1950</freq>
            <phase>180</phase>
            <amp>1.0</amp>
        </Tone>

        <Tone>
            <freq>2100</freq>
            <phase>225</phase>
            <amp>1.0</amp>
        </Tone>

        <Tone>
            <freq>2250</freq>
            <phase>270</phase>
            <amp>1.0</amp>
        </Tone>

        <Tone>
            <freq>2400</freq>
            <phase>315</phase>
            <amp>1.0</amp>
        </Tone>

        <Tone>
            <freq>2550</freq>
            <phase>0</phase>
            <amp>1.0</amp>
        </Tone>

        <Tone>
            <freq>2700</freq>
            <phase>45</phase>
            <amp>1.0</amp>
        </Tone>

        <Tone>
            <freq>2850</freq>
            <phase>90</phase>
            <amp>1.0</amp>
        </Tone>

        <Tone>
            <freq>3000</freq>
            <phase>135</phase>
            <amp>1.0</amp>
        </Tone>

        <Tone>
            <freq>3150</freq>
            <phase>180</phase>
            <amp>1.0</amp>
        </Tone>

        <Tone>
            <freq>3300</freq>
            <phase>225</phase>
            <amp>1.0</amp>
        </Tone>

        <Tone>
            <freq>3450</freq>
            <phase>270</phase>
            <amp>1.0</amp>
        </Tone>

        <Tone>
            <freq>3600</freq>
            <phase>315</phase>
            <amp>1.0</amp>
        </Tone>

        <Tone>
            <freq>3750</freq>
            <phase>0</phase>
            <amp>1.0</amp>
        </Tone>

        <Tone>
            <freq>3900</freq>
            <phase>45</phase>
            <amp>1.0</amp>
        </Tone>

        <Tone>
            <freq>4050</freq>
            <phase>90</phase>
            <amp>1.0</amp>
        </Tone>

        <Tone>
            <freq>4200</freq>
            <phase>135</phase>
            <amp>1.0</amp>
        </Tone>

        <Tone>
            <freq>4350</freq>
            <phase>180</phase>
            <amp>1.0</amp>
        </Tone>

        <Tone>
            <freq>4500</freq>
            <phase>225</phase>
            <amp>1.0</amp>
        </Tone>

        <Tone>
            <freq>4650</freq>
            <phase>270</phase>
            <amp>1.0</amp>
        </Tone>

        <Tone>
            <freq>4800</freq>
            <phase>315</phase>
            <amp>1.0</amp>
        </Tone>

    </Signal>
</Sequence>
